Carimbo de data/hora,1 - Em qual município está ocorrendo a ação ou ameaças de despejo?,2 - Qual o nome da ocupação/comunidade onde ocorreu a ação ou ameaça de despejo?,3 - Quantas famílias estão sendo despejadas ou ameaçadas?,4 - Qual o endereço ou ponto de referência da ocupação ou comunidade que está sofrendo o despejo / ameaça de despejo? (especificar da forma mais completa possível),5 - Estágio do conflito:,"6 - A ação  ou ameaça de despejo ocorreu, está agendada ou tem grande risco de ocorrer durante a pandemia de Covid-19? (Março - período atual)",7 - Descreva o que aconteceu ou está acontecendo:,"8 - Como você classificaria a etnia (raça, cor) da maioria da comunidade? ",9 - Qual o gênero da MAIORIA dos líderes de família?                                                                         (Cisgênero = é a pessoa que se identifica com o sexo biológico designado no momento de seu nascimento.                                                      Transgênero: é quem se identifica com um gênero diferente daquele atribuído no nascimento.          Não-binário: é alguém que não se identifica completamente com o “gênero de nascença” nem com outro gênero. ) ,10- Desde quando a comunidade/ocupação existe no local?,11 - Desde quando existe a ameaça de despejo? ,12 - Quando ocorreu ou para quando está agendado o despejo?,13 - Qual o caráter do imóvel? ,14 - Qual a tipologia da comunidade/ocupação?,15 - Quem é responsável pela ameaça ou ação de despejo?,16 - Qual o motivo da ameaça de remoção ou despejo?,17 - Existe alguma ação na justiça? Informe o número se tiver conhecimento,18 - Você tem algum link de notícia ou postagem sobre despejo? ,19 - A comunidade possui assessoria jurídica?,"20 - Algum movimento social, entidade ou coletivo já estão acompanhando o caso? Se sim, qual?","21 - Houve ameaça a alguma liderança comunitária por causa da ameaça de despejo ou do despejo? Se sim, explique.","22 - Se possível, informe uma pessoa e telefone com DDD para contato (caso precisarmos complementar alguma informação sobre o caso)."
08/01/2021 15:20:18,Vitória,Ocupação da Escola São Vicente de Paulo,14,"Rua Muniz Freire, nº 133, Centro, Vitória/ES",Despejo já ocorreu,Sim,"Ação de reintegração de posse movida pelo Município de Vitória em face de 14 famílias, cerca de 42 pessoas, que ocupavam a antiga escola São Vicente de Paulo. A liminar foi deferida para efetivar a reintegração, porém foi condicionada a realocação das famílias em algum local digno. Efetivada a reintegração, 7 famílias passaram a ocupar o abrigo Andorinhas ",,,24/07/2018,01/12/2018,26/03/2020,Público,Ocupação de edifício,Município,Reintegração de posse/conflito com o proprietário,00357827020188080024,https://g1.globo.com/es/espirito-santo/noticia/antigo-colegio-sao-vicente-de-paula-e-ocupado-por-familias-em-vitoria.ghtml,Defensoria Pública,MNLM (Movimento Nacional de Luta por Moradia),,Núcleo de Defesa Agrária e Moradia (NUDAM) da Defensoria Pública do Estado do Espírito Santo – 3222-7781
08/01/2021 15:26:01,Anchieta,"Loteamento Praia de Guanabara, Anchieta/ES",12,"Lotes de números 10, 11, 12, 13, 14, 15 e 16, da quadra 06, localizados na Rua dos Namorados, s/n, Loteamento Praia de Guanabara, Anchieta/ES",Ameaça sem previsão de data,Não,"Ação de reintegração de posse movida pelo proprietário dos lotes em face de um requerido, no entanto, no momento de cumprimento de mandado de imissão de posse do imóvel, se atestou várias pessoas ocupando e residindo no local. Assim, após receberem cópias do mandado de imissão no dia 27/03/18, procuraram a Defensoria Pública.",,,01/01/2011,27/03/2018,,Privado,Ocupação de terreno,Proprietário Privado,Reintegração de posse/conflito com o proprietário,00140657220128080004,,Defensoria Pública,Não,,Núcleo de Defesa Agrária e Moradia (NUDAM) da Defensoria Pública do Estado do Espírito Santo – 3222-7781
08/01/2021 15:40:34,Serra,Comunidade Cantinho do Céu,300,"Cantinho do Céu, Carapina Central, Serra/ES",Ameaça sem previsão de data,Não,"Ação de reintegração de posse em face de 60 pessoas, mas que na verdade afeta 1000 pessoas. A apreciação da medida cautelar está em análise no STJ e, por isso, não há data para acontecer o despejo.",,,01/01/2002,02/12/2009,,Privado,Ocupação de terreno,Proprietário Privado,Reintegração de posse/conflito com o proprietário,00272626420098080048,,Defensoria Pública,Não,,Núcleo de Defesa Agrária e Moradia (NUDAM) da Defensoria Pública do Estado do Espírito Santo – 3222-7781
08/01/2021 15:43:47,Serra,Novo Horizonte,40,"Lotes 1 a 22, da Quadra 28, da Rua “m”, do bairro Novo Horizonte, Carapina, Serra/ES.",Ameaça sem previsão de data,Sim,"Ação de reintegração de posse iniciada no ano de 1987 referente a um terreno em Serra. Os pedidos do autor foram julgados procedentes em 2005, entretanto, ao tentar cumprir o mandado, o Sr. Oficial de Justiça verificou a existência de outras trinta famílias no local, tornando impossível o seu cumprimento. Após tantos anos, ainda não houve cumprimento de reintegração, mas está com risco iminente.",,,01/04/1992,01/01/1995,,Privado,Ocupação de terreno,Proprietário Privado,Reintegração de posse/conflito com o proprietário,00094502919978080048,,Defensoria Pública,Não,,Núcleo de Defesa Agrária e Moradia (NUDAM) da Defensoria Pública do Estado do Espírito Santo – 3222-7781
08/01/2021 15:49:10,Serra,Vista do Mestre,40,"Área denominada “Vista do Mestre”, Avenida Vitória, em Central Carapina, Serra/ES",Despejo já ocorreu,Não,"Ação de reintegração de posse ajuizada pela “Pacífico Construções LTDA” em face de uma coletividade. A liminar possessória foi proferida. Houve a desocupação, mas recentemente, houve uma reocupação.",,,01/05/2017,01/06/2017,01/01/2017,Privado,Ocupação de terreno,Proprietário Privado,Reintegração de posse/conflito com o proprietário,00165339520178080048,,Defensoria Pública,Não,,Núcleo de Defesa Agrária e Moradia (NUDAM) da Defensoria Pública do Estado do Espírito Santo – 3222-7781
08/01/2021 15:53:16,Vila Velha,Loteamento Morada da Barra,42,"Lotes de terreno localizado no Loteamento Morada da Barra – área “B”, Vila Velha, ES",Ameaça sem previsão de data,Não,"Ação de reintegração de posse movida por suposto proprietário em face de famílias que ocupam lotes de terrenos em Morada da Barra. Os proprietários (cinco imobiliárias) haviam abandonado o terreno há anos. A parte autora ajuizou ação de reintegração de posse em face de determinado indivíduo em julho de 2012, no decorrer da lide outras pessoas foram ocupando o imóvel. Foi pedido a extensão dos pedidos para a reintegração dos outros lotes, mas foi negado em sede de agravo no TJES. ",,,01/01/2012,01/07/2012,,Privado,Ocupação de terreno,Proprietário Privado,Reintegração de posse/conflito com o proprietário,00323377920168080035,,Defensoria Pública,Não,,Núcleo de Defesa Agrária e Moradia (NUDAM) da Defensoria Pública do Estado do Espírito Santo – 3222-7781
08/01/2021 15:55:42,Serra,Pontal das Laranjais,7,"Bairro Pontal das Laranjais, município de Serra/ES",Ameaça sem previsão de data,Não,"O Ministério Público do Espírito Santo ajuizou ação civil pública em face de diversos moradores do Bairro Pontal das Laranjeiras, alegando estarem ocupando área de proteção ambiental. Primeiramente houve concessão de liminar para a desocupação, mas, posteriormente, houve interposição de agravo de instrumento e em razão de decisão proferida, o juiz suspendeu o cumprimento de reintegração.",,,01/01/2005,01/01/2016,,Público,Ocupação de terreno,Ministério Público,Questões ambientais/área de interesse ambiental,00237044020168080048,,Defensoria Pública,Não,,Núcleo de Defesa Agrária e Moradia (NUDAM) da Defensoria Pública do Estado do Espírito Santo – 3222-7781
08/01/2021 16:04:56,Fundão,Praia Grande,8,"Área situada nas margens da Rod. ES-010, denominada como Rua das Perdizes, em Praia Grande, Fundão/ES",Ameaça sem previsão de data,Não,"Ação popular ajuizada no ano de 2001 contra o Município de Fundão e algumas pessoas jurídicas de direito privado sob o argumento de que uma determinada área supostamente pública estaria indevidamente sendo ocupada por terceiros. Houve controvérsia nesse ponto e está sendo averiguada se a área é realmente pública ou privada. A petição inicial era inepta e o pedido da parte autora se restringia ao embargo de obras no local, o que acarretava na desocupação das famílias ocupantes da área.",,,01/01/1998,01/01/2000,,está em análise,Ocupação de terreno,Cidadão local por meio de Ação Civil Pública,ação popular haja vista uma suposta lesão a patrimônio público ,00004693620018080059,,Defensoria Pública,Não,,Núcleo de Defesa Agrária e Moradia (NUDAM) da Defensoria Pública do Estado do Espírito Santo – 3222-7781
08/01/2021 16:06:46,Serra,Associação de Moradores do Parque Residencial Serra Dourada II,toda a comunidade local,"Imóvel descrito como campo de futebol, atrás da Igreja Maranata, situado na Rua Rodrigues Tavares, próximo a Rua Gardênia, Loteamento Capivari, Serra Dourada II, Serra/ES",Ameaça sem previsão de data,Não,"A associação de Moradores do Parque Residencial Serra Dourada II entrou com ação de reintegração de posse do campo de futebol pois os réus adentraram no imóvel e começaram a realizar ações para comercializar o mesmo. O campo de futebol é uma área de lazer, usada por toda a comunidade local, afetando todos igualmente. ",,,01/01/1990,01/02/2016,,Cedido à comuidade,Ocupação de terreno,Proprietário Privado,Reintegração de posse/conflito com o proprietário,00023996320178080048,,Defensoria Pública,Não,,Núcleo de Defesa Agrária e Moradia (NUDAM) da Defensoria Pública do Estado do Espírito Santo – 3222-7781
08/01/2021 16:08:31,Cariacica,Bairro Flexal II,7,"Rua Sagrada, Bairro Flexal II, em Cariacica/ES",Ameaça sem previsão de data,Não,"Ação de reintegração de posse de um imóvel em face de ocupantes do mesmo, relatando a parte autora que é legitima possuidora. No entanto, a propriedade supostamente é da COHAB (está sendo analisado). A liminar de reintegração foi primeiramente deferida e depois suspensa e houve audiências de conciliação, porém, infrutíferas. ",,,27/12/2016,27/12/2016,,está em análise,Ocupação de terreno,Proprietário Privado,Reintegração de posse/conflito com o proprietário,00002397620178080012,,Defensoria Pública,Não,,Núcleo de Defesa Agrária e Moradia (NUDAM) da Defensoria Pública do Estado do Espírito Santo – 3222-7781
08/01/2021 16:10:07,Guarapari,Loteamento Village do Sol,33,"Vários lotes do Loteamento Village do Sol, localizados em Guarapari/ES",Ameaça sem previsão de data,Não,"a Imobiliária Garantia Ltda subitamente passou a derrubar cercas e construções locais em lotes do Village do Sol ondem residem várias pessoas ameaçando-as a se retirarem do local. Em razão disso, a Defensoria Pública entrou com ação civil pública a fim de proteger a posse dos moradores do loteamento Village do Sol de possíveis ameaças. No entanto, a inicial foi rejeitada, na forma do art. 485, I c/c art. 330, III. Houve apelação. A maioria dos moradores não são mais ameaçados, mas há uma minora que ainda é.",,,01/01/2011,01/07/2018,,Privado,Ocupação de terreno,Proprietário Privado,Reintegração de posse/conflito com o proprietário,00052676120188080021,,Defensoria Pública,Não,,Núcleo de Defesa Agrária e Moradia (NUDAM) da Defensoria Pública do Estado do Espírito Santo – 3222-7781
08/01/2021 16:12:25,Linhares,Distrito de Palhal,50,"Estrada do Palhal, s/nº, Distrito de Bebedouro, Linhares/ES",Despejo já ocorreu,Não,"Ação de reintegração de posse ajuizada pela Petrobras em desfavor de MST. Foi julgada procedente e houve a reintegração, no entanto, houve reocupação. O processo já foi arquivado.",,,04/05/2015,01/05/2015,16/07/2016,Público,Ocupação de terreno,Governo do Estado,Reintegração de posse/conflito com o proprietário,00058060520158080030,,Defensoria Pública,MST (Movimento dos Sem Terra),,Núcleo de Defesa Agrária e Moradia (NUDAM) da Defensoria Pública do Estado do Espírito Santo – 3222-7781
08/01/2021 16:13:54,Vitória,Ocupação Chico Prego,159,"Prédio Presidente Vargas, antiga sede do Instituto de Aposentadoria e Pensões dos Industriários (IAPI), localizado no Centro de Vitória/ES",Despejo já ocorreu,Não,"Ação de reintegração de posse ajuizada pela União Federal em face do Movimento Nacional de Luta por Moradia, foi deferida e efetivada em 23/07/17. Um dos argumentos para a reintegração foi a destinação do prédio em moradia popular.",,,06/05/2017,01/06/2017,23/07/2017,Público,Ocupação de edifício,Governo Federal,Reintegração de posse/conflito com o proprietário,00126009720174025001,https://g1.globo.com/espirito-santo/noticia/familias-desocupam-predio-do-iapi-no-centro-de-vitoria.ghtml,Defensoria Pública,MNLM (Movimento Nacional de Luta por Moradia),,Núcleo de Defesa Agrária e Moradia (NUDAM) da Defensoria Pública do Estado do Espírito Santo – 3222-7781
08/01/2021 16:15:47,Nova Venécia,Fazenda Neblina,34,"Fazenda Neblina, localizado no Córrego Serra de Cima, em Nova Venécia",Despejo já ocorreu,Não,Ação de reintegração de posse proposta pelo espólio de determinado indivíduo em face de ocupantes de um imóvel rural conhecido como Fazenda Neblina. Reintegração cumprida. Sentença de procedência transitada em julgado. Arquivado.,,,02/04/2017,01/04/2017,01/01/2019,Privado,Ocupação de terreno,Proprietário Privado,Reintegração de posse/conflito com o proprietário,00016091220178080038,,Defensoria Pública,MST (Movimento dos Sem Terra),,Núcleo de Defesa Agrária e Moradia (NUDAM) da Defensoria Pública do Estado do Espírito Santo – 3222-7781
08/01/2021 16:17:24,Linhares,Fazenda Nossa Senhora da Saúde,160,Fazenda Nossa Senhora da Saúde em Linhares ,Ameaça sem previsão de data,Sim,"Ação de reintegração de posse ajuizada por Fibria Celulose S/A em face de ocupantes que estavam ocupando seu terreno. A liminar foi deferida para a reintegração, mas atualmente, está aguardando diligência da parte autora que foi intimada para se manifestar sobre negociação.",,,12/09/2016,12/09/2016,,Privado,Ocupação de terreno,Proprietário Privado,Reintegração de posse/conflito com o proprietário,00111482620178080030,,Defensoria Pública,MST (Movimento dos Sem Terra),,Núcleo de Defesa Agrária e Moradia (NUDAM) da Defensoria Pública do Estado do Espírito Santo – 3222-7781
08/01/2021 16:18:48,Montanha,Fazenda Rio Itaúnas,120,"Fazenda Rio Itaúnas, Vinhático e no lugar denominado Rio Itaúnas, Município de Montanha/ES ",Ameaça sem previsão de data,Não,"Fibria Celulose ajuizou ação de reintegração de posse em face de integrantes do MST. Primeiramente, houve a concessão de liminar de desocupação, no entanto, a parte autora requereu a suspensão da ordem, tendo em vista a possibilidade de negociação entre as partes. Previamente, foi novamente concedida a reintegração, no entanto, seu cumprimento foi postergado para posterior determinação do juízo, em razão preocupante contexto atual.",,,19/07/2016,01/08/2016,,Privado,Ocupação de terreno,Proprietário Privado,Reintegração de posse/conflito com o proprietário,00011782720168080033,,Defensoria Pública,MST (Movimento dos Sem Terra),,Núcleo de Defesa Agrária e Moradia (NUDAM) da Defensoria Pública do Estado do Espírito Santo – 3222-7781
08/01/2021 16:20:14,Colatina,Loteamento Morada do Vale,13,"Conjunto residencial de 13 unidades habitacionais no loteamento Morada do Vale, no Bairro Barbados em Colatina/ES",Despejo já ocorreu,Não,Ação de reintegração de posse em face de 13 famílias que estavam ocupando as 13 unidades habitacionais do loteamento Morada do Vale em Colatina,,,01/08/2016,01/08/2016,25/01/2018,Privado,Ocupação de terreno,Proprietário Privado,Reintegração de posse/conflito com o proprietário,00300398020168080014,,Defensoria Pública,Não,,Núcleo de Defesa Agrária e Moradia (NUDAM) da Defensoria Pública do Estado do Espírito Santo – 3222-7781
08/01/2021 16:28:35,Vitória,Ocupação do antigo Cine Santa Cecília ,45,"Antigo Cine Santa Cecília, localizado na esquina da avenida República com avenida Cleto Nunes, Parque Moscoso, Centro, Vitória/ES",Despejo já ocorreu,Não,"O Município de Vitoria entrou com ação de reintegração de posse do Edifício Santa Cecília em face do Movimento Nacional de Luta por Moradia (MNLM) que foi deferido pelo juiz, porém o cumprimento do mandado de reintegração de posse ficou condicionado à garantia do direito à moradia, como planejamento de desocupação e realocação das famílias ",,,28/07/2017,01/08/2017,,Público,Ocupação de edifício,Município,Reintegração de posse/conflito com o proprietário,00229669020178080024,https://www.seculodiario.com.br/cidades/familias-que-ocupam-santa-cecilia-conseguem-cadastro-em-unidade-de-saude,Defensoria Pública,Não,,Núcleo de Defesa Agrária e Moradia (NUDAM) da Defensoria Pública do Estado do Espírito Santo – 3222-7781
08/01/2021 16:38:28,Serra,Bairro Cidade Pomar,30,"Terreno sem número escriturado localizado no final da rua Acerola, no bairro Cidade Pomar, Serra/ES ",Ameaça sem previsão de data,Não,"Ação de reintegração de posse com pedido liminar movida pelo proprietário em face de alguns ocupantes, no entanto, houve alegação da área na realidade ser estadual e não privada. Essa situação será analisada pela perícia. A liminar foi revogada, mas se for averiguado que a área não é da COHAB, volta a liminar de reintegração",,,01/11/2013,01/06/2015,,está em análise,Ocupação de terreno,Proprietário Privado,Reintegração de posse/conflito com o proprietário,00148352520168080048,,Defensoria Pública,Não,,Núcleo de Defesa Agrária e Moradia (NUDAM) da Defensoria Pública do Estado do Espírito Santo – 3222-7781
08/01/2021 16:39:54,Cariacica,Loteamento Residencial Padre Gabriel II,40,"Loteamento Residencial Padre Gabriel II, em Padre Gabriel II, Serra",Despejo já ocorreu,Não,"O Município de Vitoria entrou com ação de reintegração de posse das áreas públicas do loteamento, a liminar foi deferida para a reintegração. Houve também uma ação civil pública ajuizada pela Defensoria Pública, em que foi solicitado aluguel social, o qual foi indeferido. Houve interposição de agravo de instrumento, que também foi indeferido, no entanto, felizmente o Município voluntariamente concedeu aluguel social para as famílias por um período de tempo.",,,01/03/2014,01/01/2014,01/01/2017,Público,Ocupação de terreno,Município,Reintegração de posse/conflito com o proprietário,00229654920148080012,https://www.seculodiario.com.br/cidades/justica-determina-reintegracao-de-posse-contra-40-familias-em-cariacica,Defensoria Pública,Não,,Núcleo de Defesa Agrária e Moradia (NUDAM) da Defensoria Pública do Estado do Espírito Santo – 3222-7781
11/01/2021 15:53:48,Serra,"Serra Dourada II, III, Porto Canoa e Mata da Serra",100,"Imóveis do conjunto residencial de moradia popular, dos bairros Serra Dourada II, III, Porto Canoa e Mata da Serra, no município de Serra/ES",Ameaça sem previsão de data,Sim,"a Defensoria Pública propôs a ação civil pública com pedido de tutela antecipada contra Banco Econômico, em razão de um leilão que estava acontecendo na época com os imóveis de famílias que possuíam posse legitima. Houve deferimento de liminar para a manutenção de posse das famílias. Para algumas famílias, a ameaça cessou, no entanto, outras ainda estão em busca de acordo para se manterem na posse do imóvel, em razão de outras questões não relacionadas ao leilão e caso não haja acordo, seus imóveis poderão ir a venda.",,,01/01/2000,01/01/2014,,Privado,Ocupação de terreno,,Banco Econômico por meio da realização de um leilão com os imoveis dos moradores que possuem posse legítima  ,00305885620148080048,,Defensoria Pública,Não,,Núcleo de Defesa Agrária e Moradia (NUDAM) da Defensoria Pública do Estado do Espírito Santo – 3222-7781
11/01/2021 16:33:30,Guarapari,Bairro Condados de Meaípe,200,"dezenas de lotes de terra que formam o Bairro Condados de Meaípe (área também conhecida como “Sítio Pedrinha ou Braço de Pedra”), na cidade de Guarapari/ES",Ameaça sem previsão de data,Não,"Ação de natureza reivindicatória pelo espólio de dois indivíduos, cujo objeto é a imissão na posse em dezenas de lotes de terra, onde residem centenas de famílias (sem precisão para a quantidade de pessoas, em torno de 200 a 250 famílias). Houve acordos individuais neste processo",,,01/01/2000,01/01/2013,,Privado,Ocupação de terreno,Proprietário Privado,Reintegração de posse/conflito com o proprietário,00005759220138080021,,Defensoria Pública,Não,,Núcleo de Defesa Agrária e Moradia (NUDAM) da Defensoria Pública do Estado do Espírito Santo – 3222-7781
11/01/2021 16:34:56,Serra,Loteamento Jardim Serra Verde,11,"Lote 11 a 33 da Quadra 49 e Lotes 11 a 20 e 22 a 26 da Quadra 54, do Loteamento denominado Jardim Serra Verde, no município da Serra/ES",Ameaça sem previsão de data,Não,Ação reivindicatória em que o autor alega ser proprietário de diversos imóveis localizados em um Loteamento na Serra. Foi julgada procedente para a desocupação dos réus. Foram propostos embargos de declaração,,,01/01/1997,01/01/2010,,Privado,Ocupação de terreno,Proprietário Privado,Reintegração de posse/conflito com o proprietário,00001092220108080048,,Defensoria Pública,Não,,Núcleo de Defesa Agrária e Moradia (NUDAM) da Defensoria Pública do Estado do Espírito Santo – 3222-7781
11/01/2021 16:36:44,Linhares,Bairro Aviso,11,"Avenida Rui Barbosa, bairro Aviso, Centro de Linhares/ES",Ameaça sem previsão de data,Não,"Ação Civil Pública ajuizada pelo Município de linhares em face de moradores de vários imoveis localizados supostamente em área pública, requerendo a demolição das construções feitas. Após audiência de conciliação, firmou-se a análise de concessão do programa “Minha Casa Minha Vida” a parte requerida. Houve tentativas de acordo para realocação das famílias, mas infrutíferas. Risco iminente de remoção",,,01/01/1990,20/02/2017,,Público,Ocupação de terreno,Município,Reintegração de posse/conflito com o proprietário,00239838020168080030,,Defensoria Pública,Não,,Núcleo de Defesa Agrária e Moradia (NUDAM) da Defensoria Pública do Estado do Espírito Santo – 3222-7781
11/01/2021 16:38:09,Serra,Associação dos Sem Terra e Sem Teto do Município de Serra da Serra/ES ,200,"Chácaras de nº 100, 101, 102, 103, 104 e 105, todos situados na 4º Avenida (atual Avenida Gonçalves Dias) e Rua S (atual Rua Coelho Neto), bairro Jardim Limoeiro, Município de Serra/ES",Ameaça sem previsão de data,Não,"Ação reivindicatória ajuizada por particular e sua esposa em face uma coletividade vulnerável, em razão de estarem ocupado indevidamente seu imóvel. O juízo julgou procedente, garantindo a desapropriação indireta (antes era ação possessória), converteu o direito em indenização e o Município de Serra deverá atuar para que seja feita a regularização fundiária da área para titulação de todos os moradores. Mas ainda não transitou em julgado, cabendo ainda recurso para remoção das famílias. ",,,01/01/2002,01/01/2008,,Privado,Ocupação de terreno,Proprietário Privado,Reintegração de posse/conflito com o proprietário,00249597720098080048,http://www.defensoria.es.def.br/site/index.php/2020/01/14/dpes-garante-direito-moradia-para-cerca-de-200-familias-na-serra/,Defensoria Pública,Não,,Núcleo de Defesa Agrária e Moradia (NUDAM) da Defensoria Pública do Estado do Espírito Santo – 3222-7781
11/01/2021 16:39:32,Vila Velha,Conjunto Habitacional de Interesse Social Vista do Mar,200,"“Conjunto Habitacional de Interesse Social Vista do Mar”, situado no lugar denominado de Ilha dos Tatus (entrada do Bairro Terra Vermelha), Vila Velha/ES",Ameaça sem previsão de data,Não,Ação de reintegração de posse movida pela União Cooperativa Empresarial Imobiliária que aduz ser proprietária de vários lotes ocupados por centenas de pessoas ,,,,01/01/2015,01/01/2016,Privado,Ocupação de terreno,Proprietário Privado,Reintegração de posse/conflito com o proprietário,00324235020168080035,,Defensoria Pública,Não,,Núcleo de Defesa Agrária e Moradia (NUDAM) da Defensoria Pública do Estado do Espírito Santo – 3222-7781
11/01/2021 16:42:29,Vitória,Complexo Loren Reno,4,"Complexo Loren Reno, no antigo Colégio Americano, situado na rua Loren Reno, nº 51, bairro Moscoso, Centro, Vitória/ES",Ameaça sem previsão de data,Sim,"Ação de reintegração de posse movida pelo Município de Vitória em face de ocupantes do Complexo Loren Reno. O juiz proferiu decisão concedendo a antecipação de tutela requerida pela Prefeitura Municipal de Vitória, de modo a determinar a reintegração de posse do referido imóvel. Em razão disso, recentemente a Defensoria requereu a suspensão do cumprimento enquanto estiver vigente o decreto estadual nº 0446/2020. ",,,08/10/2017,07/11/2018,,Público,Ocupação de edifício,Município,Reintegração de posse/conflito com o proprietário,00259025420188080024,,Defensoria Pública,Não,,Núcleo de Defesa Agrária e Moradia (NUDAM) da Defensoria Pública do Estado do Espírito Santo – 3222-7781
